<!DOCTYPE IP SYSTEM "dtd.dtd">
<IP>
<documentation></documentation>

<version></version>

<entity name="default_ip_name">
<list_params><param>param1</param>
<param>param2</param>
<param>param3</param>
<param>param4</param>
</list_params><list_bus><signal name="ddd">
<direction>IN</direction>
<high_val>0</high_val>
<low_val>0</low_val>
<is_bit>TRUE</is_bit>
<is_reset>FALSE</is_reset>
<is_clock>FALSE</is_clock>
<initial_val></initial_val>
<is_flipflop>FALSE</is_flipflop>
<reference></reference>
<comment>N/A</comment>
</signal>
</list_bus>
</entity>


<package name="default_ip_name">
<list_bus></list_bus>
</package>

<list_arch>
<arch name="rtl">
<type></type>
<list_enumtype></list_enumtype>
<list_bus></list_bus>
<body>


<list_maps></list_maps>

<list_stat></list_stat>

<list_process></list_process>

<list_plain></list_plain>


</body>
</arch>
</list_arch>
<project_man></project_man>
</IP>

