<!DOCTYPE IP SYSTEM "dtd.dtd">
<IP>
<documentation></documentation>

<version></version>

<entity name="default_ip_nameXXX">
<list_params></list_params><list_bus><signal name="a">
<direction>IN</direction>
<high_val>0</high_val>
<low_val>0</low_val>
<is_bit>TRUE</is_bit>
<is_reset>FALSE</is_reset>
<is_clock>FALSE</is_clock>
<initial_val></initial_val>
<is_flipflop>FALSE</is_flipflop>
<reference></reference>
<comment>N/A</comment>
</signal>
<signal name="b">
<direction>IN</direction>
<high_val>0</high_val>
<low_val>0</low_val>
<is_bit>TRUE</is_bit>
<is_reset>FALSE</is_reset>
<is_clock>FALSE</is_clock>
<initial_val></initial_val>
<is_flipflop>FALSE</is_flipflop>
<reference></reference>
<comment>N/A</comment>
</signal>
<signal name="c">
<direction>OUT</direction>
<high_val>0</high_val>
<low_val>0</low_val>
<is_bit>TRUE</is_bit>
<is_reset>FALSE</is_reset>
<is_clock>FALSE</is_clock>
<initial_val></initial_val>
<is_flipflop>FALSE</is_flipflop>
<reference></reference>
<comment>N/A</comment>
</signal>
<signal name="d">
<direction>OUT</direction>
<high_val>0</high_val>
<low_val>0</low_val>
<is_bit>TRUE</is_bit>
<is_reset>FALSE</is_reset>
<is_clock>FALSE</is_clock>
<initial_val></initial_val>
<is_flipflop>FALSE</is_flipflop>
<reference></reference>
<comment>N/A</comment>
</signal>
</list_bus>
</entity>


<package name="default_ip_name">
<list_bus></list_bus>
</package>

<list_arch>
<arch name="rtl">
<type>N/A</type>
<list_enumtype></list_enumtype>
<list_bus></list_bus>
<body>


<list_maps></list_maps>

<list_stat></list_stat>

<list_process><process>
<comment>         </comment>
<label>new_process0</label>
<sens_list><sig_name>a</sig_name>
<sig_name>b</sig_name>
</sens_list>
<list_intsructions><instruction>
<sig_name>c</sig_name>
<simple_instruction>
<simple_instruction>
<sig_name>a</sig_name>
</simple_instruction>
<op>AND</op>
<simple_instruction>
<sig_name>b</sig_name>
</simple_instruction>
</simple_instruction>
</instruction>
</list_intsructions>
</process>
<process>
<comment>    </comment>
<label>process_d</label>
<sens_list><sig_name>a</sig_name>
<sig_name>b</sig_name>
</sens_list>
<list_intsructions><instruction>
<sig_name>d</sig_name>
<simple_instruction>
<simple_instruction>
<sig_name>a</sig_name>
</simple_instruction>
<op>OR</op>
<simple_instruction>
<sig_name>b</sig_name>
</simple_instruction>
</simple_instruction>
</instruction>
</list_intsructions>
</process>
</list_process>

<list_plain></list_plain>


</body>
</arch>
</list_arch>
<project_man></project_man>
</IP>

